tanggal,judul,url,label,max,min,sentiment
12/2/2021,yang bikin banyak positif bukan acara pernikahannya tapi testnya,https://turnbackhoax.id/2021/02/12/salah-yang-bikin-banyak-positif-bukan-acara-pernikahannya-tapi-testnya/,0,0.8,-0.6,4
12/2/2021,kecpanjang bandar lampung di hantam banjir,https://turnbackhoax.id/2021/02/12/salah-kec-panjang-bandar-lampung-di-hantam-banjir/,0,0,-0.8,-4
11/2/2021,vietnam tanpa kasus kematian akibat covid19 karena campuran teh panas dan lemon,https://turnbackhoax.id/2021/02/11/salah-vietnam-tanpa-kasus-kematian-akibat-covid-19-karena-campuran-teh-panas-dan-lemon/,0,0.6,-0.8,-4
11/2/2021,fadli zon dipecat dari jabatan waketum gerindra,https://turnbackhoax.id/2021/02/11/salah-fadli-zon-dipecat-dari-jabatan-waketum-gerindra/,0,0,-0.8,-4
11/2/2021,ustadz maaher meninggal karena disuntik paksa di penjara,https://turnbackhoax.id/2021/02/11/salah-ustadz-maaher-meninggal-karena-disuntik-paksa-di-penjara/,0,0.8,-0.8,0
11/2/2021,surat tim publikasi dirgahayu hut ke 28 tahun kota tangerang,https://turnbackhoax.id/2021/02/11/salah-surat-tim-publikasi-dirgahayu-hut-ke-28-tahun-kota-tangerang/,0,0.2,-0.6,-3
11/2/2021,kematian ustadz maaher akibat disuntik vaksin,https://turnbackhoax.id/2021/02/11/salah-kematian-ustadz-maaher-akibat-disuntik-vaksin/,0,0.8,-0.6,4
11/2/2021,isi bbm gratis di spbu seluruh indonesia pada tanggal 2930 februari 2021,https://turnbackhoax.id/2021/02/11/salah-isi-bbm-gratis-di-spbu-seluruh-indonesia-pada-tanggal-29-30-februari-2021/,0,0.6,-0.8,-4
11/2/2021,video sriwijayaair emergency landing atau crash,https://turnbackhoax.id/2021/02/11/salah-video-sriwijayaair-emergency-landing-atau-crash/,0,0,-0.6,-3
11/2/2021,pulau sumba dijual,https://turnbackhoax.id/2021/02/11/salah-pulau-sumba-dijual/,0,0,0,0
10/2/2021,minum air hangat 4 kali sehari dapat menyembuhkan covid19,https://turnbackhoax.id/2021/02/10/salah-minum-air-hangat-4-kali-sehari-dapat-menyembuhkan-covid-19/,0,0.6,-0.8,-4
10/2/2021,uang redenominasi pecahan rp100 bergambar jokowi,https://turnbackhoax.id/2021/02/10/salah-uang-redenominasi-pecahan-rp100-bergambar-jokowi/,0,0,0,0
10/2/2021,ra karror menikahi dua perempuan sekaligus,https://turnbackhoax.id/2021/02/10/salah-ra-karror-menikahi-dua-perempuan-sekaligus/,0,0.2,0,1
10/2/2021,tangkapan layar artikel disebut tersingkir dari jabatannya sebagai waketum partai gerindra fadli zon saya akan angkat kaki dari indonesia,https://turnbackhoax.id/2021/02/10/salah-tangkapan-layar-artikel-disebut-tersingkir-dari-jabatannya-sebagai-waketum-partai-gerindra-fadli-zon-saya-akan-angkat-kaki-dari-indonesia/,0,0.8,-1,-5
10/2/2021,sampul koran tempo berjudul babakbelur di ronde kedua,https://turnbackhoax.id/2021/02/10/salah-sampul-koran-tempo-berjudul-babak-belur-di-ronde-kedua/,0,0.4,-1,-5
10/2/2021,video selamatkan jasad mereka sriwijayaairsj182,https://turnbackhoax.id/2021/02/10/salah-video-selamatkan-jasad-mereka-sriwijayaairsj182/,0,0,0,0
10/2/2021,foto istri tusuk suami usai lihat fotonya dengan wanita lain ternyata perempuan itu dirinya sendiri pas masih kurus,https://turnbackhoax.id/2021/02/10/salah-foto-istri-tusuk-suami-usai-lihat-fotonya-dengan-wanita-lain-ternyata-perempuan-itu-dirinya-sendiri-pas-masih-kurus/,0,0.8,-0.8,0
9/2/2021,video markas power rangers ada di indonesia,https://turnbackhoax.id/2021/02/09/salah-video-markas-power-rangers-ada-di-indonesia/,0,0.8,0,4
9/2/2021,setahun koma di rumah sakit begitu siuman pria ini syok orangorang tercinta meninggal karena covid,https://turnbackhoax.id/2021/02/09/salah-setahun-koma-di-rumah-sakit-begitu-siuman-pria-ini-syok-orang-orang-tercinta-meninggal-karena-covid/,0,1,-0.8,5
9/2/2021,video sriwijayaair detikdetik jatuh nya pesawat 182 kepulaunseribu pontianak,https://turnbackhoax.id/2021/02/09/salah-video-sriwijayaair-detikdetik-jatuh-nya-pesawat-182-kepulaunseribu-pontianak/,0,0,-0.6,-3
9/2/2021,sri sultan pertanyakan keaslian ijazah jokowi dari ugm,https://turnbackhoax.id/2021/02/09/salah-sri-sultan-pertanyakan-keaslian-ijazah-jokowi-dari-ugm/,0,0,-0.6,-3
9/2/2021,jokowi ternyata sudah pakai rp385 triliun dana haji jamaah tak diberitahu,https://turnbackhoax.id/2021/02/09/salah-jokowi-ternyata-sudah-pakai-rp-385-triliun-dana-haji-jamaah-tak-diberitahu/,0,0.6,0,3
8/2/2021,menyamar dengan baju nakes tentara cina berhasil masuk ke indonesia,https://turnbackhoax.id/2021/02/08/salah-menyamar-dengan-baju-nakes-tentara-cina-berhasil-masuk-ke-indonesia/,0,1,-0.6,5
8/2/2021,terseret korupsi dana formula e anies baswedan terancam penjara seumur hidup,https://turnbackhoax.id/2021/02/08/salah-terseret-korupsi-dana-formula-e-anies-baswedan-terancam-penjara-seumur-hidup/,0,0.6,-0.8,-4
8/2/2021,lowongan kerja terbaru pt pertamina tahun 2021,https://turnbackhoax.id/2021/02/08/salah-lowongan-kerja-terbaru-pt-pertamina-tahun-2021/,0,0.6,0,3
8/2/2021,warga prancis berbondong bondong masuk islam,https://turnbackhoax.id/2021/02/08/salah-warga-prancis-berbondong-bondong-masuk-islam/,0,0.2,-0.6,-3
8/2/2021,foto spesies hewan baru muncul di chernobyl,https://turnbackhoax.id/2021/02/08/salah-foto-spesies-hewan-baru-muncul-di-chernobyl/,0,0.6,0,3
8/2/2021,akun whatsapp wakil wali kota jambi tawarkan bantuan,https://turnbackhoax.id/2021/02/08/salah-akun-whatsapp-wakil-wali-kota-jambi-tawarkan-bantuan/,0,0.6,-0.2,3
8/2/2021,video banjir di tanah tinggi cameron highland malaysia,https://turnbackhoax.id/2021/02/08/salah-video-banjir-di-tanah-tinggi-cameron-highland-malaysia/,0,0.4,-0.8,-4
7/2/2021,akun facebook bupati sanggau paolus hadi,https://turnbackhoax.id/2021/02/07/salah-akun-facebook-bupati-sanggau-paolus-hadi/,0,0,0,0
7/2/2021,fenomena banjir darah di pekalongan,https://turnbackhoax.id/2021/02/07/salah-fenomena-banjir-darah-di-pekalongan/,0,0.8,-0.8,0
7/2/2021,beli pulsa kena pajak,https://turnbackhoax.id/2021/02/07/salah-beli-pulsa-kena-pajak/,0,0.2,-1,-5
7/2/2021,bantuan pulsa 200 ribu dan kuota 75 gb dari kominfo,https://turnbackhoax.id/2021/02/07/salah-bantuan-pulsa-200-ribu-dan-kuota-75-gb-dari-kominfo/,0,0.6,-1,-5
7/2/2021,jakarta tanggal 1215 februari lockdown,https://turnbackhoax.id/2021/02/07/salah-jakarta-tanggal-12-15-februari-lockdown/,0,0,-0.8,-4
7/2/2021,suara uang tunai di atm suara palsu yang dihasilkan speaker,https://turnbackhoax.id/2021/02/07/salah-suara-uang-tunai-di-atm-suara-palsu-yang-dihasilkan-speaker/,0,0.6,-0.8,-4
7/2/2021,setelah difucksin otak jadi lelet,https://turnbackhoax.id/2021/02/07/salah-setelah-difucksin-otak-jadi-lelet/,0,1,0,5
7/2/2021,akun whatsapp wali kota bogor bima arya sugiarto,https://turnbackhoax.id/2021/02/07/salah-akun-whatsapp-wali-kota-bogor-bima-arya-sugiarto/,0,0,-0.2,-1
7/2/2021,akun whatsapp sekretaris daerah kabupaten pandeglang h pery hasanudin sh mh,https://turnbackhoax.id/2021/02/07/salah-akun-whatsapp-sekretaris-daerah-kabupaten-pandeglang-h-pery-hasanudin-sh-mh/,0,0,0,0
7/2/2021,daftar harga tiket pesawat ke bandara di purbalingga,https://turnbackhoax.id/2021/02/07/salah-daftar-harga-tiket-pesawat-ke-bandara-di-purbalingga/,0,0.4,-0.6,-3
7/2/2021,gubernur anies baswedan bangun bandara jb soedirman di purbalingga,https://turnbackhoax.id/2021/02/07/salah-gubernur-anies-baswedan-bangun-bandara-jb-soedirman-di-purbalingga/,0,0,0,0
7/2/2021,imbauan penutupan pasar dan tempat wisata diy oleh sri sultan hb x,https://turnbackhoax.id/2021/02/07/salah-imbauan-penutupan-pasar-dan-tempat-wisata-diy-oleh-sri-sultan-hb-x/,0,0,-0.6,-3
7/2/2021,kapal tenggelam di selat bali pada 5 februari 2021,https://turnbackhoax.id/2021/02/07/salah-kapal-tenggelam-di-selat-bali-pada-5-februari-2021/,0,0,-0.8,-4
7/2/2021,anies jakarta macet tak betul juga kalau jam 2 pagi sepi,https://turnbackhoax.id/2021/02/07/salah-anies-jakarta-macet-tak-betul-juga-kalau-jam-2-pagi-sepi/,0,0.8,-0.8,0
7/2/2021,isran noor kantor yang buka akan kami rudal,https://turnbackhoax.id/2021/02/07/salah-isran-noor-kantor-yang-buka-akan-kami-rudal/,0,0.8,-0.6,4
7/2/2021,yahya waloni menuai balasan dari ucapannya yang menantang covid19 dan enggan menggunakan masker,https://turnbackhoax.id/2021/02/07/salah-yahya-waloni-menuai-balasan-dari-ucapannya-yang-menantang-covid-19-dan-enggan-menggunakan-masker/,0,0.2,-0.8,-4
7/2/2021,obat klorin dioksida temuan prof dr richard claproth dapat menyembuhkan covid19,https://turnbackhoax.id/2021/02/07/salah-obat-klorin-dioksida-temuan-prof-dr-richard-claproth-dapat-menyembuhkan-covid-19/,0,0.6,-0.2,3
6/2/2021,biaya pendidikan sistem kampus merdeka universitas negri yogyakarta,https://turnbackhoax.id/2021/02/06/salah-biaya-pendidikan-sistem-kampus-merdeka-universitas-negri-yogyakarta/,0,0,-0.8,-4
6/2/2021,video air rebusan belimbing wuluh dapat mencegah dan menyembuhkan covid19,https://turnbackhoax.id/2021/02/06/salah-video-air-rebusan-belimbing-wuluh-dapat-mencegah-dan-menyembuhkan-covid-19/,0,0.6,-0.8,-4
6/2/2021,penjualan genose c19 seharga 75 juta di facebook,https://turnbackhoax.id/2021/02/06/salah-penjualan-genose-c19-seharga-75-juta-di-facebook/,0,0.8,0,4
6/2/2021,foto aung san suu kyi berhadapan dengan pasukan militer,https://turnbackhoax.id/2021/02/06/salah-foto-aung-san-suu-kyi-berhadapan-dengan-pasukan-militer/,0,0.6,-1,-5
6/2/2021,psbb jawa bali di perpanjang sampai 28 maret 2021,https://turnbackhoax.id/2021/02/06/salah-psbb-jawa-bali-di-perpanjang-sampai-28-maret-2021/,0,0.4,0,2
5/2/2021,tuduhan rekayasa video aerobik bang jago di myanmar,https://turnbackhoax.id/2021/02/05/salah-tuduhan-rekayasa-video-aerobik-bang-jago-di-myanmar/,0,0.4,-0.8,-4
5/2/2021,video dua orang psikopat memaksa seorang pria memakan sup berisi daging dan usus istrinya sendiri dari deep web,https://turnbackhoax.id/2021/02/05/salah-video-dua-orang-psikopat-memaksa-seorang-pria-memakan-sup-berisi-daging-dan-usus-istrinya-sendiri-dari-deep-web/,0,0.2,-0.8,-4
5/2/2021,foto satelit retakan bawah laut akibat gempa sulbar,https://turnbackhoax.id/2021/02/05/salah-foto-satelit-retakan-bawah-laut-akibat-gempa-sulbar/,0,0.6,-0.2,3
5/2/2021,semua fraksi sepakat copot anies,https://turnbackhoax.id/2021/02/05/salah-semua-fraksi-sepakat-copot-anies/,0,0.6,-0.6,0
5/2/2021,ramuan penangkal covid19 oleh kemenkes,https://turnbackhoax.id/2021/02/05/salah-ramuan-penangkal-covid-19-oleh-kemenkes/,0,0,0,0
5/2/2021,presenter tv one diberi sensor berupa hijab untuk menutup aurat,https://turnbackhoax.id/2021/02/05/salah-presenter-tv-one-diberi-sensor-berupa-hijab-untuk-menutup-aurat/,0,0,-0.8,-4
5/2/2021,sinyal sos berarti save our soul oleh korban sriwijaya air sj182 di pulau laki,https://turnbackhoax.id/2021/02/05/salah-sinyal-sos-berarti-save-our-soul-oleh-korban-sriwijaya-air-sj-182-di-pulau-laki/,0,0.6,-0.6,0
5/2/2021,biaya tilang terbaru di indonesia kapolri baru mantap,https://turnbackhoax.id/2021/02/05/salah-biaya-tilang-terbaru-di-indonesia-kapolri-baru-mantap/,0,0.8,-0.4,4
4/2/2021,foto contoh anak raja salman arab yg kuliah di amerika,https://turnbackhoax.id/2021/02/04/salah-foto-contoh-anak-raja-salman-arab-yg-kuliah-di-amerika/,0,0.6,-0.6,0
4/2/2021,erdogan builds 70000 elite settlements,https://turnbackhoax.id/2021/02/04/false-erdogan-builds-70000-elite-settlements/,0,0.2,0,1
4/2/2021,75 tahun indonesia merdeka baru di zaman jokowi lah sumatera mempunyai jalan tol,https://turnbackhoax.id/2021/02/04/salah-75-tahun-indonesia-merdeka-baru-di-zaman-jokowi-lah-sumatera-mempunyai-jalan-tol/,0,0.6,0,3
4/2/2021,video mkd dpr resmi copot fadli zon,https://turnbackhoax.id/2021/02/04/salah-video-mkd-dpr-resmi-copot-fadli-zon/,0,0.8,0,4
4/2/2021,jokowi minta risma gantikan anies,https://turnbackhoax.id/2021/02/04/salah-jokowi-minta-risma-gantikan-anies/,0,0.2,0,1
3/2/2021,menteri kesehatan thailand menangis saat disuntik vaksin covid19,https://turnbackhoax.id/2021/02/03/salah-menteri-kesehatan-thailand-menangis-saat-mendapat-vaksin-covid-19/,0,0,-0.6,-3
3/2/2021,bantuan covid19 untuk pemilik sim a dan c oleh asuransi jasa raharja,https://turnbackhoax.id/2021/02/03/salah-bantuan-covid-19-untuk-pemilik-sim-a-dan-c-oleh-asuransi-jasa-raharja/,0,0.6,0,3
3/2/2021,taktik baru scammer melalui status whatsapp,https://turnbackhoax.id/2021/02/03/salah-taktik-baru-scammer-melalui-status-whatsapp/,0,0.2,0,1
3/2/2021,video berita terbaru hari ini ribuan masyarakat papua mengamuk soal rasisme natalius pigai viral news,https://turnbackhoax.id/2021/02/03/salah-video-berita-terbaru-hari-ini-ribuan-masyarakat-papua-mengamuk-soal-rasisme-natalius-pigai-viral-news/,0,0.6,-1,-5
3/2/2021,whatsapp dikenai biaya setelah diakuisisi oleh facebook,https://turnbackhoax.id/2021/02/03/salah-whatsapp-dikenai-biaya-setelah-diakuisisi-oleh-facebook/,0,0,-0.4,-2
3/2/2021,anies pastikan tolak utang luar negeri jika pimpinan ri,https://turnbackhoax.id/2021/02/03/salah-anies-pastikan-tolak-utang-luar-negeri-jika-pimpinan-ri/,0,0.4,-1,-5
3/2/2021,satu2nya negara yg tidak ada covid19nya tanzania mereka gak pernah adakan rapid test n pcr kepada penduduknya,https://turnbackhoax.id/2021/02/03/salah-satu2nya-negara-yg-tidak-ada-covid19-nya-tanzania-mereka-gak-pernah-adakan-rapid-test-n-pcr-kepada-penduduknya/,0,0,-0.8,-4
3/2/2021,erdogan bangun 70000 pemukiman elit,https://turnbackhoax.id/2021/02/03/salah-erdogan-bangun-70-000-pemukiman-elit/,0,0,0,0
2/2/2021,video detik detik kecelakaan motor dan kereta api pada 28 januari 2021 di sukoharjo,https://turnbackhoax.id/2021/02/02/salah-video-detik-detik-kecelakaan-motor-dan-kereta-api-pada-28-januari-2021-di-sukoharjo/,0,0,-0.8,-4
2/2/2021,surat laporan kasus korupsi anies baswedan yang dihilangkan kpk ri ditemukan,https://turnbackhoax.id/2021/02/02/salah-surat-laporan-kasus-korupsi-anies-baswedan-yang-dihilangkan-kpk-ri-ditemukan/,0,0,-0.8,-4
2/2/2021,pesan berantai paradox vaksin,https://turnbackhoax.id/2021/02/02/salah-pesan-berantai-paradox-vaksin/,0,1,0,5
2/2/2021,test ge nose c19 mudah n murah rp 15 rb 10 detik akurasi 999 gak hrs swab gak hrs diambil darah,https://turnbackhoax.id/2021/02/02/salah-test-ge-nose-c19-mudah-n-murah-rp-15-rb-10-detik-akurasi-999-gak-hrs-swab-gak-hrs-diambil-darah/,0,0.8,0,4
2/2/2021,anies raih piala lomba mewarnai,https://turnbackhoax.id/2021/02/02/salah-anies-raih-piala-lomba-mewarnai/,0,0.8,0,4
1/2/2021,video anda harus tahu kebenaran ada jarum suntikspuit palsu dipersiapkan untuk para pemimpin dunia,https://turnbackhoax.id/2021/02/01/salah-video-anda-harus-tahu-kebenaran-ada-jarum-suntik-spuit-palsu-dipersiapkan-untuk-para-pemimpin-dunia/,0,0.8,-1,-5
1/2/2021,video cawapres usa kamala harris disuntik vasin disiarkan live di tv sadarlah kebohongan sedang di lancarkan,https://turnbackhoax.id/2021/02/01/salah-video-cawapres-usa-kamala-harris-disuntik-vasin-disiarkan-live-di-tv-sadarlah-kebohongan-sedang-di-lancarkan/,0,0.6,0,3
1/2/2021,video viralkan ini kelakuan perempuan laknat thd pembatu,https://turnbackhoax.id/2021/02/01/salah-video-viralkan-ini-kelakuan-perempuan-laknat-thd-pembatu/,0,0,-0.6,-3
1/2/2021,sms berhadiah cek rp35000000 dari bri,https://turnbackhoax.id/2021/02/01/salah-sms-berhadiah-cek-rp35-000-000-dari-bri/,0,0,-1,-5
1/2/2021,pramugari pesawat sj182 menangis karena firasat sebelum pesawat jatuh,https://turnbackhoax.id/2021/02/01/salah-pramugari-pesawat-sj182-menangis-karena-firasat-sebelum-pesawat-jatuh/,0,0,-0.8,-4
31/01/2021,dua kekasih tidak lepas berpelukan setelah berhubungan intim di jalan,https://turnbackhoax.id/2021/01/31/salah-dua-kekasih-tidak-lepas-berpelukan-setelah-berhubungan-intim-di-jalan/,0,1,-0.6,5
31/01/2021,anak 10 bulan ikut ditahan akibat sang ibu ketahuan mencuri,https://turnbackhoax.id/2021/01/31/salah-anak-10-bulan-ikut-ditahan-akibat-sang-ibu-ketahuan-mencuri/,0,0.8,-1,-5
31/01/2021,gereja haramkan vaksin kok mui halalkan vaksin,https://turnbackhoax.id/2021/01/31/salah-gereja-haramkan-vaksin-kok-mui-halalkan-vaksin/,0,0,-0.4,-2
31/01/2021,lantunan bacaan alquran seorang anak papua,https://turnbackhoax.id/2021/01/31/salah-lantunan-bacaan-al-quran-seorang-anak-papua/,0,0,-0.6,-3
31/01/2021,hancur sudah jokowi menjual indonesia,https://turnbackhoax.id/2021/01/31/salah-hancur-sudah-jokowi-menjual-indonesia/,0,0.6,-0.8,-4
31/01/2021,sms berhadiah 100 juta dari telkomsel,https://turnbackhoax.id/2021/01/31/salah-sms-berhadiah-100-juta-dari-telkomsel/,0,0.8,-0.6,4
31/01/2021,akun facebook gubernur kalimantan timur isran noor,https://turnbackhoax.id/2021/01/31/salah-akun-facebook-gubernur-kalimantan-timur-isran-noor/,0,0,0,0
30/01/2021,bayi katak,https://turnbackhoax.id/2021/01/30/salah-bayi-katak/,0,0,-0.6,-3
29/01/2021,gubernur anies baswedan mengecat rumah warga untuk antisipasi banjir,https://turnbackhoax.id/2021/01/29/salah-gubernur-anies-baswedan-mengecat-rumah-warga-untuk-antisipasi-banjir/,0,0.8,-0.8,0
29/01/2021,bank indonesia cetak uang 300 triliyun,https://turnbackhoax.id/2021/01/29/salah-bank-indonesia-cetak-uang-300-triliyun/,0,0,0,0
28/01/2021,lianhua qingwen dapat digunakan sebagai obat covid19,https://turnbackhoax.id/2021/01/28/salah-lianhua-qingwen-dapat-digunakan-sebagai-obat-covid-19/,0,0.6,-1,-5
28/01/2021,akun facebook dan website xiaomi indonesia,https://turnbackhoax.id/2021/01/28/salah-akun-facebook-dan-website-xiaomi-indonesia/,0,0,0,0
28/01/2021,tautan bantuan sosial finansial rp3550000 untuk pekerja tahun 20002021,https://turnbackhoax.id/2021/01/28/salah-tautan-bantuan-sosial-finansial-rp3-550-000-untuk-pekerja-tahun-2000-2021/,0,1,0,5
28/01/2021,foto fadli zon memberikan bantuan handphone kepada mahasiswi yang kurang mampu,https://turnbackhoax.id/2021/01/28/salah-foto-fadli-zon-memberikan-bantuan-handphone-kepada-mahasiswi-yang-kurang-mampu/,0,0.8,-0.6,4
28/01/2021,nomor palsu satgas covid19 beredar di whatsapp,https://turnbackhoax.id/2021/01/28/salah-nomor-palsu-satgas-covid-19-beredar-di-whatsapp/,0,0.4,-0.8,-4
28/01/2021,pengawal biden sekarang dari pasukan cina?,https://turnbackhoax.id/2021/01/28/salah-pengawal-biden-sekarang-dari-pasukan-cina/,0,0,-1,-5
28/01/2021,sunrise manidharshana,https://turnbackhoax.id/2021/01/28/false-sunrise-manidharshana/,0,0,0,0
28/01/2021,berkumur dengan air hangat dan air garam dapat menghilangkan virus corona,https://turnbackhoax.id/2021/01/28/salah-berkumur-dengan-air-hangat-dan-air-garam-dapat-menghilangkan-virus-corona/,0,0.6,-0.6,0
28/01/2021,fenomena langka matahari manidharshana,https://turnbackhoax.id/2021/01/28/salah-fenomena-langka-matahari-manidharshana/,0,1,0,5
27/01/2021,minum air kelapa sebagai penangkal racun usai divaksin,https://turnbackhoax.id/2021/01/27/salah-minum-air-kelapa-sebagai-penangkal-racun-usai-divaksin/,0,0.6,-1,-5
27/01/2021,bahwa michelle obama dulunya adalah seorang transgender,https://turnbackhoax.id/2021/01/27/salah-bahwa-michelle-obama-dulunya-adalah-seorang-transgender/,0,0,0,0
26/01/2021,kumham hapus sanksi pidana setelah anak buah megawati tolak vaksin,https://turnbackhoax.id/2021/01/26/salah-kumham-hapus-sanksi-pidana-setelah-anak-buah-megawati-tolak-vaksin/,0,0.6,-0.6,0
26/01/2021,joe biden menggunakan massonic illuminaty biblekitab setan dlm sumpahnya mnjdi presiden,https://turnbackhoax.id/2021/01/26/salah-joe-biden-menggunakan-massonic-illuminaty-biblekitab-setan-dlm-sumpahnya-mnjdi-presiden/,0,0.6,-0.8,-4
26/01/2021,undian resmi whatsapp rp175 juta,https://turnbackhoax.id/2021/01/26/salah-undian-resmi-whatsapp-rp175-juta/,0,0.8,-0.8,0
26/01/2021,gambar kondisi rizieq shihab makin kritis dan sedang dibimbing bacaan ayat suci alquran,https://turnbackhoax.id/2021/01/26/salah-gambar-kondisi-rizieq-shihab-makin-kritis-dan-sedang-dibimbing-bacaan-ayat-suci-al-quran/,0,1,-0.8,5
25/01/2021,karena disuntik vaksin dokter di palembang meninggal,https://turnbackhoax.id/2021/01/25/salah-karena-disuntik-vaksin-dokter-di-palembang-meninggal/,0,0,-0.8,-4
25/01/2021,kartel narkoba lolos presiden filipina beri peringatan pada jokowi,https://turnbackhoax.id/2021/01/25/salah-kartel-narkoba-lolos-presiden-filipina-beri-peringatan-pada-jokowi/,0,0.6,-0.8,-4
25/01/2021,olimpiade tokyo 2021 dibatalkan,https://turnbackhoax.id/2021/01/25/salah-olimpiade-tokyo-2021-dibatalkan/,0,0,-0.6,-3
25/01/2021,21 cara cek hp disadap,https://turnbackhoax.id/2021/01/25/salah-21-cara-cek-hp-disadap/,0,0,-1,-5
24/01/2021,julio iglesias meninggal karena covid19,https://turnbackhoax.id/2021/01/24/salah-julio-iglesias-meninggal-karena-covid19/,0,0,-0.8,-4
24/01/2021,tangkapan layar gus milos saat dihubungi pihak metro tv yang memberikan bantuan bagi korban banjir,https://turnbackhoax.id/2021/01/24/salah-tangkapan-layar-gus-milos-saat-dihubungi-pihak-metro-tv-yang-memberikan-bantuan-bagi-korban-banjir/,0,0.6,-0.8,-4
24/01/2021,kesan abdul somad saat divaksin ndak terasa sakit tak sesakit ditinggal pas lagi sayangsayangnya,https://turnbackhoax.id/2021/01/24/salah-kesan-abdul-somad-saat-divaksin-ndak-terasa-sakit-tak-sesakit-ditinggal-pas-lagi-sayang-sayangnya/,0,0.8,-0.8,0
24/01/2021,foto anak korban vaksinasi covid,https://turnbackhoax.id/2021/01/24/salah-foto-anak-korban-vaksinasi-covid/,0,0.6,-0.6,0
23/01/2021,menag yaqut tidak lagi anggarkan dana untuk pesantren,https://turnbackhoax.id/2021/01/23/salah-menag-yaqut-tidak-lagi-anggarkan-dana-untuk-pesantren/,0,0.6,-0.6,0
23/01/2021,indonesia tidak dapat menggugat jika vaksin bermasalah,https://turnbackhoax.id/2021/01/23/salah-indonesia-tidak-dapat-menggugat-jika-vaksin-bermasalah/,0,0,-0.8,-4
23/01/2021,surat perintah karantina selama dua minggu bagi warga amerika serikat,https://turnbackhoax.id/2021/01/23/salah-surat-perintah-karantina-selama-dua-minggu-bagi-warga-amerika-serikat/,0,0.6,-0.4,3
23/01/2021,steak berbahan dasar kotoran manusia dari jepang,https://turnbackhoax.id/2021/01/23/salah-steak-berbahan-dasar-kotoran-manusia-dari-jepang/,0,0.6,-0.8,-4
23/01/2021,ada 32 hotel di jakarta untuk isolasi mandiri yang biayanya ditanggung pemerintah,https://turnbackhoax.id/2021/01/23/salah-ada-32-hotel-di-jakarta-untuk-isolasi-mandiri-yang-biayanya-ditanggung-pemerintah/,0,0.8,-0.6,4
23/01/2021,ketua bpom ditekan dan diancam untuk keluarkan vaksin sinovac,https://turnbackhoax.id/2021/01/23/salah-ketua-bpom-ditekan-dan-diancam-untuk-keluarkan-vaksin-sinovac/,0,0,-0.2,-1
22/01/2021,badanmu akan terlihat seperti ini jika kamu beruntung tetap hidup setelah tersambar petir,https://turnbackhoax.id/2021/01/22/salah-badanmu-akan-terlihat-seperti-ini-jika-kamu-beruntung-tetap-hidup-setelah-tersambar-petir/,0,0.8,-0.6,4
22/01/2021,surat pengangkatan tenaga honorer dari menteri panrb,https://turnbackhoax.id/2021/01/22/salah-surat-pengangkatan-tenaga-honorer-dari-menteri-panrb/,0,0.6,-0.8,-4
22/01/2021,akun idx di telegram,https://turnbackhoax.id/2021/01/22/salah-akun-idx-di-telegram/,0,0,0,0
22/01/2021,lowongan kerja pt freeport indonesia,https://turnbackhoax.id/2021/01/22/salah-lowongan-kerja-pt-freeport-indonesia/,0,0.2,0,1
22/01/2021,foto pemerintahan biden mengibarkan bendera rusia,https://turnbackhoax.id/2021/01/22/salah-foto-pemerintahan-biden-mengibarkan-bendera-rusia/,0,0.6,-0.6,0
22/01/2021,vaksinasi presiden harus diulang dan hatihati dengan vaksinasi,https://turnbackhoax.id/2021/01/22/salah-vaksinasi-presiden-harus-diulang-dan-hati-hati-dengan-vaksinasi/,0,0.6,-0.8,-4
21/01/2021,tangkapan layar video cnn memberitakan rakyat akan dibunuh oleh vaksin dari tiongkok,https://turnbackhoax.id/2021/01/21/salah-tangkapan-layar-video-cnn-memberitakan-rakyat-akan-dibunuh-oleh-vaksin-dari-tiongkok/,0,0,-0.8,-4
21/01/2021,diagram chip 5g pada vaksin covid19,https://turnbackhoax.id/2021/01/21/salah-diagram-chip-5g-pada-vaksin-covid-19/,0,0,-0.8,-4
21/01/2021,gelang power balance dapat menyembuhkan corona,https://turnbackhoax.id/2021/01/21/salah-gelang-power-balance-dapat-menyembuhkan-corona/,0,0.6,0,3
21/01/2021,obat covid19 dexamethasone lebih murah dari harga vaksin covid19,https://turnbackhoax.id/2021/01/21/salah-obat-covid-19-dexamethasone-lebih-murah-dari-harga-vaksin-covid-19/,0,0.4,-0.6,-3
21/01/2021,ijazah sma jokowi palsu,https://turnbackhoax.id/2021/01/21/salah-ijazah-sma-jokowi-palsu/,0,0,-0.8,-4
21/01/2021,razia masker serentak di seluruh indonesia dengan denda rp250 ribu,https://turnbackhoax.id/2021/01/21/salah-razia-masker-serentak-di-seluruh-indonesia-dengan-denda-rp250-ribu/,0,0.6,0,3
21/01/2021,wilalung demak lur minta doa,https://turnbackhoax.id/2021/01/21/salah-wilalung-demak-lur-minta-doa/,0,0.6,0,3
21/01/2021,undian resmi kantor shopee rp175 juta,https://turnbackhoax.id/2021/01/21/salah-undian-resmi-kantor-shopee-rp175-juta/,0,0.8,-0.8,0
21/01/2021,esemka akhirnya berekspansi besarbesaran dalam proyek antariksa,https://turnbackhoax.id/2021/01/21/salah-esemka-akhirnya-berekspansi-besar-besaran-dalam-proyek-antariksa/,0,0.8,0,4
21/01/2021,tautan pendaftaran bantuan presiden produktif usaha mikro bpum tahap ii,https://turnbackhoax.id/2021/01/21/salah-tautan-pendaftaran-bantuan-presiden-produktif-usaha-mikro-bpum-tahap-ii/,0,0.8,-1,-5
21/01/2021,akan ada gempa lebih besar dan tsunami bmkg minta masyarakat keluar dari mamuju,https://turnbackhoax.id/2021/01/21/salah-akan-ada-gempa-lebih-besar-dan-tsunami-bmkg-minta-masyarakat-keluar-dari-mamuju/,0,0.8,-0.6,4
21/01/2021,eric tohir sang missionaris chip covid19,https://turnbackhoax.id/2021/01/21/salah-penjelasan-erick-thohir-terkait-chip-covid-19-dalam-vaksin-dapat-mengontrol-manusia-seumur-hidup/,0,0,0,0
20/01/2021,pernyataan idi terkait aspartame dalam minuman instan sebabkan kanker diabetes dan pengerasan sumsum tulang belakang,https://turnbackhoax.id/2021/01/20/salah-pernyataan-idi-terkait-aspartame-dalam-minuman-instan-sebabkan-kanker-diabetes-dan-pengerasan-sumsum-tulang-belakang/,0,0.8,-0.8,0
20/01/2021,tv nasional belum siarkan berita terkait banjir yang melanda kalsel,https://turnbackhoax.id/2021/01/20/salah-tv-nasional-belum-siarkan-berita-terkait-banjir-yang-melanda-kalsel/,0,0,-1,-5
20/01/2021,pesan berantai sinyal internet dihentikan pada pukul 18002000 dan semua aktifitas hp dipantau,https://turnbackhoax.id/2021/01/20/salah-pesan-berantai-sinyal-internet-dihentikan-pada-pukul-18-00-20-00-dan-semua-aktifitas-hp-dipantau/,0,1,-0.8,5
