tanggal,judul,url,label,max,min,sentiment
20/01/2021,5 cara utk meningkatkan anti body dari regu pembasmi covid19,https://turnbackhoax.id/2021/01/20/salah-5-cara-utk-meningkatkan-anti-body-dari-regu-pembasmi-covid-19/,0,0.6,-0.6,0
20/01/2021,video tolongin kita google earth pulau laki,https://turnbackhoax.id/2021/01/20/salah-video-tolongin-kita-google-earth-pulau-laki/,0,0,0,0
20/01/2021,video pemakaman syeikh ali jaber,https://turnbackhoax.id/2021/01/20/salah-video-pemakaman-syeikh-ali-jaber/,0,0,0,0
20/01/2021,video of bill gates meeting with the cia on vaccines in 2005,https://turnbackhoax.id/2021/01/20/false-video-of-bill-gates-meeting-with-the-cia-on-vaccines-in-2005/,0,0,0,0
20/01/2021,foto banjir di kalimantan selatan,https://turnbackhoax.id/2021/01/20/salah-foto-banjir-di-kalimantan-selatan/,0,0.6,-0.8,-4
20/01/2021,gambar artikel republika tentang daftar bumbu masakmakanan mengandung babi,https://turnbackhoax.id/2021/01/20/salah-gambar-artikel-republika-tentang-daftar-bumbu-masak-makanan-mengandung-babi/,0,0.6,-0.8,-4
20/01/2021,surat tugas dan surat edaran kpk di wilayah papua,https://turnbackhoax.id/2021/01/20/salah-surat-tugas-dan-surat-edaran-kpk-di-wilayah-papua/,0,0,-0.6,-3
20/01/2021,video bill gates rapat dengan cia mengenai vaksin pada tahun 2005,https://turnbackhoax.id/2021/01/20/salah-video-bill-gates-rapat-dengan-cia-mengenai-vaksin-pada-tahun-2005/,0,0.6,-0.8,-4
19/01/2021,video puluhan santri pingsan setelah vaksin covid19 sinovac,https://turnbackhoax.id/2021/01/19/salah-video-puluhan-santri-pingsan-setelah-vaksin-covid-19-sinovac/,0,0,-0.4,-2
19/01/2021,singapura hentikan vaksinasi setelah 48 orang meninggal di negaranya,https://turnbackhoax.id/2021/01/19/salah-singapura-hentikan-vaksinasi-setelah-48-orang-meninggal-di-negaranya/,0,0,-0.2,-1
19/01/2021,video gunung semeru di lumajang keluarkan lahar dingin,https://turnbackhoax.id/2021/01/19/salah-video-gunung-semeru-di-lumajang-keluarkan-lahar-dingin/,0,0,-0.2,-1
19/01/2021,video jatuhnya pesawat indonesia,https://turnbackhoax.id/2021/01/19/salah-video-jatuhnya-pesawat-sriwijaya-air-sj-182/,0,0,-0.6,-3
19/01/2021,akun facebook dan situs ecommerce polytron indonesia,https://turnbackhoax.id/2021/01/19/salah-akun-facebook-dan-situs-e-commerce-polytron-indonesia/,0,0,0,0
19/01/2021,jenazah gempa di mamuju dibungkus dengan daun pisang,https://turnbackhoax.id/2021/01/19/salah-jenazah-gempa-di-mamuju-dibungkus-dengan-daun-pisang/,0,0.6,-0.6,0
19/01/2021,video setelah disuntik vaksin pingsan tak sadarkan diri,https://turnbackhoax.id/2021/01/19/salah-video-setelah-disuntik-vaksin-pingsan-tak-sadarkan-diri/,0,0,-0.4,-2
19/01/2021,video astronot australia lompat dari pesawat ruang angkasa,https://turnbackhoax.id/2021/01/19/salah-video-astronot-australia-lompat-dari-pesawat-ruang-angkasa/,0,0,-0.8,-4
19/01/2021,pesan berantai tautan pendaftaran kartu prakerja,https://turnbackhoax.id/2021/01/19/salah-pesan-berantai-tautan-pendaftaran-kartu-prakerja/,0,1,0,5
18/01/2021,kasdim 0817 gresik mayor sugeng riyadi meninggal akibat disuntik vaksin,https://turnbackhoax.id/2021/01/18/salah-kasdim-0817-gresik-mayor-sugeng-riyadi-meninggal-akibat-disuntik-vaksin/,0,0.2,-0.2,0
18/01/2021,merokok bisa menghadang virus corona,https://turnbackhoax.id/2021/01/18/salah-merokok-bisa-menghadang-virus-corona/,0,0,0,0
18/01/2021,akun twitter cimb niaga cimbniaga9,https://turnbackhoax.id/2021/01/18/salah-akun-twitter-cimb-niaga-cimbniaga9/,0,0,0,0
18/01/2021,vaksin covid19 itu telah bermutasi menjadi ribuan covid19 baru di seluruh dunia,https://turnbackhoax.id/2021/01/18/salah-vaksin-covid-19-itu-telah-bermutasi-menjadi-ribuan-covid-19-baru-di-seluruh-dunia/,0,0.2,-0.4,-2
18/01/2021,pembagian masker gratis dicampur obat bius,https://turnbackhoax.id/2021/01/18/salah-pembagian-masker-gratis-dicampur-obat-bius/,0,0.6,-0.2,3
18/01/2021,akun whatsapp bupati cianjur herman suherman,https://turnbackhoax.id/2021/01/18/salah-akun-whatsapp-bupati-cianjur-herman-suherman/,0,0,0,0
18/01/2021,foto garda nasional yang mengamankan acara pelantikan joe biden,https://turnbackhoax.id/2021/01/18/salah-foto-garda-nasional-yang-mengamankan-acara-pelantikan-joe-biden/,0,0.8,-0.6,4
17/01/2021,cairan nya masih utuh udah di cabut aaaja mao bohongin rakyat hadehhh,https://turnbackhoax.id/2021/01/17/salah-cairan-nya-masih-utuh-udah-di-cabut-aaaja-mao-bohongin-rakyat-hadehhh/,0,0,-0.6,-3
17/01/2021,potongan video banjir kalimantan selatan prayforkalsel banyak sapi warga yang terhanyut,https://turnbackhoax.id/2021/01/17/salah-potongan-video-banjir-kalimantan-selatan-prayforkalsel-banyak-sapi-warga-yang-terhanyut/,0,0.6,-0.8,-4
17/01/2021,bantuan pulsa sebesar rp200 ribu untuk guru dosen dan pelajar,https://turnbackhoax.id/2021/01/17/salah-bantuan-pulsa-sebesar-rp200-ribu-untuk-guru-dosen-dan-pelajar/,0,0.4,-1,-5
17/01/2021,jokowi bukan disuntik vaksin melainkan suntik vitamin,https://turnbackhoax.id/2021/01/17/salah-jokowi-bukan-disuntik-vaksin-melainkan-suntik-vitamin/,0,0,-0.4,-2
17/01/2021,lupa semuanya sby semakin parah kasihan sby jadi begini,https://turnbackhoax.id/2021/01/17/salah-lupa-semuanya-sby-semakin-parah-kasihan-sby-jadi-begini/,0,1,-1,0
17/01/2021,jika sudah disuntik vaksin covid19 tidak perlu mematuhi protokol kesehatan,https://turnbackhoax.id/2021/01/17/salah-jika-sudah-disuntik-vaksin-covid-19-tidak-perlu-mematuhi-protokol-kesehatan/,0,0.8,-0.6,4
17/01/2021,pesan berantai info donor plasma oleh blood for life indonesia,https://turnbackhoax.id/2021/01/17/salah-pesan-berantai-info-donor-plasma-mengatasnamakan-blood-for-life-indonesia/,0,1,-0.8,5
16/01/2021,ditolak menaiki pesawat karena terlibat demo di capitall hill,https://turnbackhoax.id/2021/01/16/salah-ditolak-menaiki-pesawat-karena-terlibat-demo-di-capitall-hill/,0,0.8,-1,-5
16/01/2021,lowongan kerja pt pertamina persero,https://turnbackhoax.id/2021/01/16/salah-lowongan-kerja-pt-pertamina-persero/,0,0.2,0,1
16/01/2021,berita terbaru hari ini 48 orang tewas setelah di vaksin corona agenda jahat rezim terungkap,https://turnbackhoax.id/2021/01/16/salah-berita-terbaru-hari-ini-48-orang-te-was-setelah-di-vaksin-coro-na-agenda-ja-hat-re-zim-terungkap/,0,0.6,-1,-5
16/01/2021,potongan video banjir dengan harapan kita semua yang berada di kalimantan selatan air lekas surut,https://turnbackhoax.id/2021/01/16/salah-potongan-video-banjir-dengan-harapan-kita-semua-yang-berada-di-kalimantan-selatan-air-lekas-surut/,0,0.8,-0.8,0
16/01/2021,surat elektronik rekrutmen karyawan pt paragon pratama teknologi,https://turnbackhoax.id/2021/01/16/salah-surat-elektronik-rekrutmen-karyawan-pt-paragon-pratama-teknologi/,0,0.4,0,2
16/01/2021,kronologi syekh ali jabar wafat 2 jam sebelum beliau wafat tak disangka ternyata karna vaksin ini,https://turnbackhoax.id/2021/01/16/salah-kronologi-syekh-ali-jabar-wafat-2-jam-sebelum-beliau-wafat-tak-disangka-ternyata-karna-vaksin-ini/,0,0.6,0,3
16/01/2021,emirates airlines sanksi pilot moneem saheb tabaa yang tolak terbangkan pesawat ke israel,https://turnbackhoax.id/2021/01/16/salah-emirates-airlines-sanksi-pilot-moneem-saheb-tabaa-yang-tolak-terbangkan-pesawat-ke-israel/,0,0,-0.6,-3
16/01/2021,akun twitter indo premier sekuritas,https://turnbackhoax.id/2021/01/16/salah-akun-twitter-indo-premier-sekuritas/,0,0,-0.8,-4
16/01/2021,video suasana di dalam pesawat sriwijaya air sj 182,https://turnbackhoax.id/2021/01/16/salah-video-suasana-di-dalam-pesawat-sriwijaya-air-sj-182/,0,0.8,-0.6,4
16/01/2021,ketua fraksi pdip saja ga mau di vaksin,https://turnbackhoax.id/2021/01/16/salah-ketua-fraksi-pdip-saja-ga-mau-di-vaksin/,0,1,-1,0
16/01/2021,jakarta zona hitam,https://turnbackhoax.id/2021/01/16/salah-jakarta-zona-hitam/,0,0,-0.6,-3
16/01/2021,aa gym menyikapi selamat natal,https://turnbackhoax.id/2021/01/16/salah-aa-gym-menyikapi-selamat-natal/,0,0.8,0,4
16/01/2021,jalan terputus di sendana akibat gempa majene,https://turnbackhoax.id/2021/01/16/salah-jalan-terputus-di-sendana-akibat-gempa-majene/,0,0.6,0,3
16/01/2021,pesan whatsapp oleh wabup muratara tawarkan lelang kendaraan bermotor,https://turnbackhoax.id/2021/01/16/salah-pesan-whatsapp-oleh-wabup-muratara-tawarkan-lelang-kendaraan-bermotor/,0,1,0,5
16/01/2021,pesan berantai tautan subsidi kuota belajar gelombang pertama 2021,https://turnbackhoax.id/2021/01/16/salah-pesan-berantai-tautan-subsidi-kuota-belajar-gelombang-pertama-2021/,0,1,0,5
16/01/2021,baim wong adakan bagibagi hadiah sebesar rp50000000,https://turnbackhoax.id/2021/01/16/salah-baim-wong-adakan-bagi-bagi-hadiah-sebesar-rp50-000-000/,0,0.6,0,3
16/01/2021,video anggota fpi lakukan penggerebekan,https://turnbackhoax.id/2021/01/16/salah-video-anggota-fpi-lakukan-penggerebekan/,0,0,-0.4,-2
15/01/2021,terapi uap panas dan minyak kayu putih dapat membunuh virus corona,https://turnbackhoax.id/2021/01/15/salah-terapi-uap-panas-dan-minyak-kayu-putih-dapat-membunuh-virus-corona/,0,0.6,-1,-5
15/01/2021,presiden terpilih as joe bidden mundur karena alasan kesehatan,https://turnbackhoax.id/2021/01/15/salah-presiden-terpilih-as-joe-bidden-mundur-karena-alasan-kesehatan/,0,0.6,-0.8,-4
15/01/2021,razia anak tidak bermasker akan dikarantina,https://turnbackhoax.id/2021/01/15/salah-razia-anak-tidak-bermasker-akan-dikarantina/,0,0,-0.6,-3
15/01/2021,jokowi kejang dan meninggal dunia setelah disuntik vaksin,https://turnbackhoax.id/2021/01/15/salah-jokowi-kejang-dan-meninggal-dunia-setelah-disuntik-vaksin/,0,0.2,-0.6,-3
15/01/2021,akun instagram mnc sekuritas,https://turnbackhoax.id/2021/01/15/salah-akun-instagram-mnc-sekuritas/,0,0,0,0
15/01/2021,video rekaman sebelum pesawat sriwijaya air jatuh,https://turnbackhoax.id/2021/01/15/salah-video-rekaman-sebelum-pesawat-sriwijaya-air-jatuh/,0,0.6,-0.6,0
15/01/2021,pesan whatsapp undangan rakernas peningkatan kinerja tenaga kesehatan oleh dinkes dki,https://turnbackhoax.id/2021/01/15/salah-pesan-whatsapp-undangan-rakernas-peningkatan-kinerja-tenaga-kesehatan-oleh-dinkes-dki/,0,1,0,5
14/01/2021,akun facebook bupati klaten sri mulyani,https://turnbackhoax.id/2021/01/14/salah-akun-facebook-bupati-klaten-sri-mulyani/,0,0,0,0
14/01/2021,akun facebook bupati purbalingga meminta uang dan pulsa,https://turnbackhoax.id/2021/01/14/salah-akun-facebook-bupati-purbalingga-meminta-uang-dan-pulsa/,0,0.4,-1,-5
14/01/2021,agnez mo bagibagi hadiah berupa uang tunai,https://turnbackhoax.id/2021/01/14/salah-agnez-mo-bagi-bagi-hadiah-berupa-uang-tunai/,0,0.6,0,3
14/01/2021,video pilot pesawat sriwijaya air sj182 bernyanyi dengan lagu terakhirnya,https://turnbackhoax.id/2021/01/14/salah-video-pilot-pesawat-sriwijaya-air-sj182-bernyanyi-dengan-lagu-terakhirnya/,0,0.6,-0.6,0
14/01/2021,jokowi menggunakan vaksin buatan eropa,https://turnbackhoax.id/2021/01/14/salah-jokowi-menggunakan-vaksin-buatan-eropa/,0,0,-0.4,-2
14/01/2021,video evakuasi bawah laut pesawat sriwijaya air sj 182,https://turnbackhoax.id/2021/01/14/salah-video-evakuasi-bawah-laut-pesawat-sriwijaya-air-sj-182/,0,0.6,-0.6,0
14/01/2021,rakyat aceh menolak vaksin covid19 karena menurut para ulama aceh itu haram,https://turnbackhoax.id/2021/01/14/salah-rakyat-aceh-menolak-vaksin-covid19-karena-menurut-para-ulama-aceh-itu-haram/,0,0.8,-1,-5
13/01/2021,pesan whatsapp tentang informasi saham oleh ustadz yusuf mansur,https://turnbackhoax.id/2021/01/13/salah-pesan-whatsapp-tentang-informasi-saham-oleh-ustadz-yusuf-mansur/,0,1,0,5
13/01/2021,obat covid19 dari asap batok kelapa,https://turnbackhoax.id/2021/01/13/salah-obat-covid-19-dari-asap-batok-kelapa/,0,0,-0.6,-3
13/01/2021,aceh kembali meminta kemerdekaan setelah sholat jumat di masjid raya banda aceh,https://turnbackhoax.id/2021/01/13/salah-aceh-kembali-meminta-kemerdekaan-setelah-sholat-jumat-di-masjid-raya-banda-aceh/,0,0.8,-0.2,4
13/01/2021,paus fransiskus ditangkap atas tuduhan perdagangan manusia pornografi anak dan penipuan,https://turnbackhoax.id/2021/01/13/salah-paus-fransiskus-ditangkap-atas-tuduhan-perdagangan-manusia-pornografi-anak-dan-penipuan/,0,0.6,-0.8,-4
13/01/2021,kemasan vaksin sinovac ga pake ampulan didalam box vaksin sudah ada spuit khusus yg sdh ada vaksin nya,https://turnbackhoax.id/2021/01/13/salah-kemasan-vaksin-sinovac-ga-pake-ampulan-didalam-box-vaksin-sudah-ada-spuit-khusus-yg-sdh-ada-vaksin-nya/,0,0.8,-0.2,4
13/01/2021,anies ngumpet purapura positif corona,https://turnbackhoax.id/2021/01/13/salah-anies-ngumpet-pura-pura-positif-corona/,0,0.8,0,4
13/01/2021,aturan baru facebook yang menggunakan data pribadi pemilik akun,https://turnbackhoax.id/2021/01/13/salah-aturan-baru-facebook-yang-menggunakan-data-pribadi-pemilik-akun/,0,0.6,-0.8,-4
13/01/2021,video antri pemakaman covid19 di tegal alurjkt hidup antri mau dikuburpun antri,https://turnbackhoax.id/2021/01/13/salah-video-antri-pemakaman-covid-19-di-tegal-alurjkt-hidup-antri-mau-dikuburpun-antri/,0,1,-0.2,5
13/01/2021,hirup uap air panas dua kali sehari dapat menangkal covid19,https://turnbackhoax.id/2021/01/13/salah-hirup-uap-air-panas-dua-kali-sehari-dapat-menangkal-covid-19/,0,0.6,-0.8,-4
13/01/2021,risma joget tanpa menggunakan masker,https://turnbackhoax.id/2021/01/13/salah-risma-joget-tanpa-menggunakan-masker/,0,0,0,0
12/1/2021,video detikdetik jatuhnya pesawat sriwijaya air sj 182,https://turnbackhoax.id/2021/01/12/salah-video-detik-detik-jatuhnya-pesawat-sriwijaya-air-sj-182/,0,0.6,-0.6,0
12/1/2021,rizieq shihab surati jokowi minta kasusnya dihentikan,https://turnbackhoax.id/2021/01/12/salah-rizieq-shihab-surati-jokowi-minta-kasusnya-dihentikan/,0,0.2,0,1
12/1/2021,anjing zionis israel dilatih untuk menggigit orang yang sedang sholat,https://turnbackhoax.id/2021/01/12/salah-anjing-zionis-israel-dilatih-untuk-menggigit-orang-yang-sedang-sholat/,0,0.4,-0.8,-4
12/1/2021,tiongkok dan luhut pandjaitan merencanakan pembunuhan massal terhadap pribumi dengan 40 ribu ton alat tes covid19,https://turnbackhoax.id/2021/01/12/salah-tiongkok-dan-luhut-pandjaitan-merencanakan-pembunuhan-massal-terhadap-pribumi-dengan-40-ribu-ton-alat-tes-covid-19/,0,0.8,-1,-5
12/1/2021,21 pasien mengalami efek samping setelah memakai vaksin moderna,https://turnbackhoax.id/2021/01/12/salah-21-pasien-mengalami-efek-samping-setelah-memakai-vaksin-moderna/,0,0.6,-0.6,0
12/1/2021,setengah karyawan btc pangkalpinang positif covid19,https://turnbackhoax.id/2021/01/12/salah-setengah-karyawan-btc-pangkalpinang-positif-covid-19/,0,0.8,-0.4,4
12/1/2021,pesan berantai rekrutmen relawan untuk merawat pasien covid 19 di wisma atlet oleh dokter irna,https://turnbackhoax.id/2021/01/12/salah-pesan-berantai-rekrutmen-relawan-untuk-merawat-pasien-covid-19-di-wisma-atlet-oleh-dokter-irna/,0,1,0,5
12/1/2021,video proses pengangkatan badan pesawat sriwijaya air sj 182,https://turnbackhoax.id/2021/01/12/salah-video-proses-pengangkatan-badan-pesawat-sriwijaya-air-sj-182/,0,0.6,-0.8,-4
12/1/2021,detik detik di dalam pesawat sebelum meledak dan jatuh pesawatjatuh pesawatsriwijaya sriwijayaairsj182,https://turnbackhoax.id/2021/01/12/salah-detik-detik-di-dalam-pesawat-sebelum-meledak-dan-jatuh-pesawatjatuh-pesawatsriwijaya-sriwijayaairsj182/,0,0.8,-0.8,0
12/1/2021,transkrip video cockpit voice recorder cvr percakapan pilot sj182,https://turnbackhoax.id/2021/01/12/salah-transkrip-video-cockpit-voice-recorder-cvr-percakapan-pilot-sj182/,0,0,0,0
12/1/2021,artikel tendang jeff bezos elon musk kini orang terkaya di dunia berkat vtube,https://turnbackhoax.id/2021/01/12/salah-artikel-tendang-jeff-bezos-elon-musk-kini-orang-terkaya-di-dunia-berkat-vtube/,0,0.6,-0.8,-4
11/1/2021,pdip menolak dng tegas hukuman mati bagi koruptor dengan alasan semua koruptor adalah teman sehidup semati mereka?,https://turnbackhoax.id/2021/01/11/salah-pdip-menolak-dng-tegas-hukuman-mati-bagi-koruptor-dengan-alasan-semua-koruptor-adalah-teman-sehidup-semati-mereka/,0,0.8,-0.6,4
11/1/2021,video temuan barang dan puing kecelakaan pesawat sriwijaya sj182,https://turnbackhoax.id/2021/01/11/salah-video-temuan-barang-dan-puing-kecelakaan-pesawat-sriwijaya-sj182/,0,0,-0.8,-4
11/1/2021,rizieq shihab sakit yang tidak normal karena diracuni,https://turnbackhoax.id/2021/01/11/salah-rizieq-shihab-sakit-yang-tidak-normal-karena-diracuni/,0,0.2,-0.8,-4
11/1/2021,foto bayi selamat dari kecelakaan pesawat sriwijaya,https://turnbackhoax.id/2021/01/11/salah-foto-bayi-selamat-dari-kecelakaan-pesawat-sriwijaya/,0,0.8,-0.8,0
11/1/2021,presiden pks akhmad syaikhu diperiksa kpk terkait kasus suap izin rumah sakit di cimahi,https://turnbackhoax.id/2021/01/11/salah-presiden-pks-akhmad-syaikhu-diperiksa-kpk-terkait-kasus-suap-izin-rumah-sakit-di-cimahi/,0,0.6,-0.8,-4
11/1/2021,link pendaftaran bantuan umkm,https://turnbackhoax.id/2021/01/11/salah-link-pendaftaran-bantuan-umkm/,0,0.6,0,3
11/1/2021,video vaksin astrazeneca menggunakan mrc5,https://turnbackhoax.id/2021/01/11/salah-video-vaksin-astrazeneca-menggunakan-mrc-5/,0,0,0,0
11/1/2021,covid19 adalah tipuan terbesar yang pernah dilakukan dan hanya flu buruk lainnya,https://turnbackhoax.id/2021/01/11/salah-covid-19-adalah-tipuan-terbesar-yang-pernah-dilakukan-dan-hanya-flu-buruk-lainnya/,0,0,-0.8,-4
10/1/2021,sakit mendadak oleh vaksin,https://turnbackhoax.id/2021/01/10/salah-sakit-mendadak-oleh-vaksin/,0,0,-0.8,-4
10/1/2021,baju fadli zon bertuliskan jubir bokep,https://turnbackhoax.id/2021/01/10/salah-baju-fadli-zon-bertuliskan-jubir-bokep/,0,0.4,-0.4,0
10/1/2021,foto barisan mobil dengan bendera amerika serikat dari california menuju washington dc,https://turnbackhoax.id/2021/01/10/salah-foto-barisan-mobil-dengan-bendera-amerika-serikat-dari-california-menuju-washington-d-c/,0,0.8,-0.6,4
10/1/2021,surat edaran mui waspada rapid test modus operandi dari pki,https://turnbackhoax.id/2021/01/10/salah-surat-edaran-mui-waspada-rapid-test-modus-operandi-dari-pki/,0,0.8,-0.6,4
10/1/2021,akun facebook wakil walikota surabaya terpilih ir armuji m n,https://turnbackhoax.id/2021/01/10/salah-akun-facebook-wakil-walikota-surabaya-terpilih-ir-armuji-m-n/,0,0.6,0,3
9/1/2021,pesan tentang video ?argentina is doing it yang dapat retas ponsel,https://turnbackhoax.id/2021/01/09/salah-pesan-tentang-video-argentina-is-doing-it-yang-dapat-retas-ponsel/,0,1,-0.8,5
9/1/2021,foto seorang wanita menggunakan kaus bertuliskan umpatan kepada anies baswedan,https://turnbackhoax.id/2021/01/09/salah-foto-seorang-wanita-menggunakan-kaus-bertuliskan-umpatan-kepada-anies-baswedan/,0,0.6,-0.8,-4
9/1/2021,video okey batman sudah tiba di capitol hill utk bubarin demo,https://turnbackhoax.id/2021/01/09/salah-video-okey-batman-sudah-tiba-di-capitol-hill-utk-bubarin-demo/,0,0.6,-0.8,-4
9/1/2021,hanya 13 ribu orang di britania raya yang terinfeksi covid19 pada tahun 2020,https://turnbackhoax.id/2021/01/09/salah-hanya-13-ribu-orang-di-britania-raya-yang-terinfeksi-covid-19-pada-tahun-2020/,0,0,-0.8,-4
9/1/2021,sekarang nussa rarra dilarang diproduksi,https://turnbackhoax.id/2021/01/09/salah-sekarang-nussa-rarra-dilarang-diproduksi/,0,0,-0.8,-4
9/1/2021,kota prabumulih kota tanpa corona,https://turnbackhoax.id/2021/01/09/salah-kota-prabumulih-kota-tanpa-corona/,0,0,-0.2,-1
9/1/2021,penerima vaksin perdana meninggal dunia usai disuntik vaksin pfizer,https://turnbackhoax.id/2021/01/09/salah-penerima-vaksin-perdana-meninggal-dunia-usai-disuntik-vaksin-pfizer/,0,0.8,-0.2,4
9/1/2021,jawabali lockdown pada tanggal 1125 januari 2021,https://turnbackhoax.id/2021/01/09/salah-jawa-bali-lockdown-pada-tanggal-11-25-januari-2021/,0,0,-0.8,-4
9/1/2021,ternyata vaksin yg akan di suntikan ke jokowi berbeda,https://turnbackhoax.id/2021/01/09/salah-ternyata-vaksin-yg-akan-di-suntikan-ke-jokowi-berbeda/,0,0.2,0,1
9/1/2021,artikel liputan6 berjudul menjadi penyanyi dangdut adalah cita cita cita citata yang sudah lama cita citata cita citakan,https://turnbackhoax.id/2021/01/09/salah-artikel-liputan6-berjudul-menjadi-penyanyi-dangdut-adalah-cita-cita-cita-citata-yang-sudah-lama-cita-citata-cita-citakan/,0,0.6,-0.8,-4
8/1/2021,wakil presiden amerika serikat mike pence ditangkap saat massa memasuki gedung capitol,https://turnbackhoax.id/2021/01/08/salah-wakil-presiden-amerika-serikat-mike-pence-ditangkap-saat-massa-memasuki-gedung-capitol/,0,0.8,0,4
8/1/2021,huawei bagikan hadiah sambut tahun baru,https://turnbackhoax.id/2021/01/08/salah-huawei-bagikan-hadiah-sambut-tahun-baru/,0,0.6,0,3
8/1/2021,inalilahi wainailaihi rojiun telah meninggalhrsdi dalam sel karna kena covid?,https://turnbackhoax.id/2021/01/08/salah-inalilahi-wainailaihi-rojiun-telah-meninggal-hrs-di-dalam-sel-karna-kena-covid/,0,0.8,-0.8,0
8/1/2021,pesan berantai wisma atlet penuh,https://turnbackhoax.id/2021/01/08/salah-pesan-berantai-wisma-atlet-penuh/,0,1,0,5
8/1/2021,pinjaman dana bantuan covid19 oleh bupati pasuruan irsyad yusuf,https://turnbackhoax.id/2021/01/08/salah-pinjaman-dana-bantuan-covid-19-oleh-bupati-pasuruan-irsyad-yusuf/,0,0.6,-0.8,-4
8/1/2021,vaksin sinovac disebutkan memberi efek samping pembesaran alat kelamin,https://turnbackhoax.id/2021/01/08/salah-vaksin-sinovac-disebutkan-memberi-efek-samping-pembesaran-alat-kelamin/,0,0.6,-1,-5
7/1/2021,fabiana souza penerima perdana suntikan vaksin covid 19 meninggal dunia di rssao lucas porto alegre brazil selatan,https://turnbackhoax.id/2021/01/07/salah-fabiana-souza-penerima-perdana-suntikan-vaksin-covid-19-meninggal-dunia-di-rs-sao-lucas-porto-alegre-brazil-selatan/,0,0.8,-0.2,4
7/1/2021,lowongan kerja pt angkasa pura ii persero untuk 19 posisi,https://turnbackhoax.id/2021/01/07/salah-lowongan-kerja-pt-angkasa-pura-ii-persero-untuk-19-posisi/,0,0.2,0,1
7/1/2021,hydro oxy mouth freshener spray dapat cegah dan sembuhkan virus covid19,https://turnbackhoax.id/2021/01/07/salah-hydro-oxy-mouth-freshener-spray-dapat-cegah-dan-sembuhkan-virus-covid-19/,0,0.6,0,3
7/1/2021,video mahfud md joget setelah membubarkan fpi,https://turnbackhoax.id/2021/01/07/salah-video-mahfud-md-joget-setelah-membubarkan-fpi/,0,0,0,0
7/1/2021,fadli zon lho hak saya dong menyukai bokep masalah anda apa,https://turnbackhoax.id/2021/01/07/salah-fadli-zon-lho-hak-saya-dong-menyukai-bokep-masalah-anda-apa/,0,0.8,-0.8,0
7/1/2021,terkait drone china prabowo mengatakan china adalah negara sahabat,https://turnbackhoax.id/2021/01/07/salah-terkait-drone-china-prabowo-mengatakan-china-adalah-negara-sahabat/,0,0.6,-0.6,0
7/1/2021,video mereka lp akn kematian 6 orng mrk melupakan semua itu mrk asyik bersukaria,https://turnbackhoax.id/2021/01/07/salah-video-mereka-lp-akn-kematian-6-orng-mrk-melupakan-semua-itu-mrk-asyik-bersukaria/,0,0.8,-0.6,4
6/1/2021,vaksin bermasalah dan mengerikan disuntik bisa menjadi sakit dan sekarat,https://turnbackhoax.id/2021/01/06/salah-vaksin-bermasalah-dan-mengerikan-disuntik-bisa-menjadi-sakit-dan-sekarat/,0,0,-0.8,-4
6/1/2021,data pengurus fpi oleh intelkam polda ntb,https://turnbackhoax.id/2021/01/06/salah-data-pengurus-fpi-oleh-intelkam-polda-ntb/,0,0.6,-0.8,-4
6/1/2021,foto korban banjir dan longsor di tanjungpinang,https://turnbackhoax.id/2021/01/06/salah-foto-korban-banjir-dan-longsor-di-tanjungpinang/,0,0.6,-0.8,-4
6/1/2021,foto wanita asal australia dengan sepasang bayi kembar,https://turnbackhoax.id/2021/01/06/salah-foto-wanita-asal-australia-dengan-sepasang-bayi-kembar/,0,0.6,-0.6,0
6/1/2021,stop beli ikan dulu terkhususnya ikan tongkol dan tembang karena ada pexakit baru sekarang,https://turnbackhoax.id/2021/01/06/salah-stop-beli-ikan-dulu-terkhususnya-ikan-tongkol-dan-tembang-karena-ada-pexakit-baru-sekarang/,0,0.8,-0.8,0
6/1/2021,lowongan kerja pt astra,https://turnbackhoax.id/2021/01/06/salah-lowongan-kerja-pt-astra/,0,0.2,0,1
6/1/2021,masjid istiqlal tidak mengadakan salat jumat karena dikuasai pki,https://turnbackhoax.id/2021/01/06/salah-masjid-istiqlal-tidak-mengadakan-salat-jumat-karena-dikuasai-pki/,0,0.8,-0.8,0
6/1/2021,akun facebook bupati serang ratu tatu chasanah meminta kode verifikasi whatsapp,https://turnbackhoax.id/2021/01/06/salah-akun-facebook-bupati-serang-ratu-tatu-chasanah-meminta-kode-verifikasi-whatsapp/,0,0.4,-0.8,-4
6/1/2021,vaksin sinovac covid19 yang akan di suntikkan kepada warga hanya untuk kelinci percobaan,https://turnbackhoax.id/2021/01/06/salah-vaksin-sinovac-covid-19-yang-akan-di-suntikkan-kepada-warga-hanya-untuk-kelinci-percobaan/,0,0,-0.8,-4
6/1/2021,video mentri agama yaqut di usir ketika hadir di tanah melayu,https://turnbackhoax.id/2021/01/06/salah-video-mentri-agama-yaqut-di-usir-ketika-hadir-di-tanah-melayu/,0,0.6,-1,-5
6/1/2021,video berita terbaru hari ini akhirnya di putuskan fpi bukan ormas terlarang,https://turnbackhoax.id/2021/01/06/salah-video-berita-terbaru-hari-ini-akhirnya-di-putuskan-fpi-bukan-ormas-terlarang/,0,0.6,-1,-5
5/1/2021,indonesia tidak bergabung ke aliansi strategis militer islam sunni karena dianggap merapat ke komunis china,https://turnbackhoax.id/2021/01/05/salah-indonesia-tidak-bergabung-ke-aliansi-strategis-militer-islam-sunni-karena-dianggap-merapat-ke-komunis-china/,0,0.8,-0.8,0
5/1/2021,wakil wali kota surabaya terpilih armuji meninggal dunia,https://turnbackhoax.id/2021/01/05/salah-wakil-wali-kota-surabaya-terpilih-armuji-meninggal-dunia/,0,0.6,-0.2,3
5/1/2021,raja thailand panggil ulama islam baca doa tolak bala covid 19,https://turnbackhoax.id/2021/01/05/salah-raja-thailand-panggil-ulama-islam-baca-doa-tolak-bala-covid-19/,0,0.8,-0.6,4
5/1/2021,vaksin sinovac mengandung sel kera hijau afrika,https://turnbackhoax.id/2021/01/05/salah-vaksin-sinovac-mengandung-sel-kera-hijau-afrika/,0,0.2,-0.8,-4
5/1/2021,akun facebook bupati probolinggo puput tantriana sari,https://turnbackhoax.id/2021/01/05/salah-akun-facebook-bupati-probolinggo-puput-tantriana-sari/,0,0,0,0
5/1/2021,tulisan dr siti fadillah terkait pengobatan covid19,https://turnbackhoax.id/2021/01/05/salah-tulisan-dr-siti-fadillah-terkait-pengobatan-covid-19/,0,0,-0.6,-3
5/1/2021,artikel cnn seorang dokter merekomendasikan vaksin covid19 disuntikkan di alat kelamin pria,https://turnbackhoax.id/2021/01/05/salah-artikel-cnn-seorang-dokter-merekomendasikan-vaksin-covid19-disuntikkan-di-alat-kelamin-pria/,0,0,-1,-5
